{
  "projectId": "0fd5bbc2-36eb-47de-837f-64f56b6e824a",
  "projectName": "Arla",
  "domain": "https://www.arla.dk/",
  "startUrls": [
    "https://www.arla.dk/sitemap.xml?type=Modules.Recipes.Business.SitemapUrlWriter.RecipeSitemapUrlWriter"
  ],
  "isFixedListOfUrls": true,
  "crawlerSchemas": [
    {
      "name": "allRecipes",
      "nodes": [
        {
          "name": "recipe",
          "type": "object",
          "getMultipleFromPage": false,
          "isRequired": true,
          "xpath": "//div[@class='c-recipe']",
          "attributes": [
            {
              "name": "heading",
              "type": "string",
              "getMultipleFromPage": false,
              "isRequired": true,
              "xpath": "./div[1]/div[1]/h1"
            },
            {
              "name": "ingredients",
              "type": "string",
              "getMultipleFromPage": true,
              "isRequired": true,
              "xpath": "./div[2]/div[2]/div/div[2]/div/table/tbody/tr/th"
            },
            {
              "name": "image",
              "type": "object",
              "getMultipleFromPage": false,
              "isRequired": false,
              "xpath": "./div[1]/div[2]/picture/img",
              "attributes": [
                {
                  "name": "src",
                  "type": "string",
                  "getMultipleFromPage": false,
                  "isRequired": false,
                  "xpath": "./@src"
                },
                {
                  "name": "alt",
                  "type": "string",
                  "getMultipleFromPage": false,
                  "isRequired": false,
                  "xpath": "./@alt"
                }
              ]
            }
          ]
        }
      ]
    }
  ]
}